0,Design better data tables
1,Your Facebook data is creepy as hell
2,"Cheat Sheets for AI, Neural Networks, Machine Learning, Deep Learning & Big Data"
3,Why so many data scientists are leaving their jobs
4,"Why SQL is beating NoSQL, and what this means for the future of data"
5,I built an app that makes learning algorithms and data structures way more fun
6,"If You Want to Be Creative, Don’t Be Data Driven"
7,Design words with data
8,The 10 Statistical Techniques Data Scientists Need to Master
9,"If you want to learn Data Science, start with one of these programming classes"
10,"I ranked every Intro to Data Science course on the internet, based on thousands of data points"
11,"The best Data Science courses on the internet, ranked by your reviews"
12,I learned all data structures in a week. This is what it did to my brain.
13,The 5 Clustering Algorithms Data Scientists Need to Know
14,A Beginner’s Guide to Data Engineering — Part I
15,Which Languages Should You Learn For Data Science?
16,Design Better Data Tables
17,I Dropped Out of School to Create My Own Data Science Master’s — Here’s My Curriculum
18,Advice For New and Junior Data Scientists
19,The 50 best free online university courses according to data
20,Finding the Right Color Palettes for Data Visualizations
21,The Rise of the Data Engineer
22,Everything you need to know about tree data structures
23,How Machines Make Sense of Big Data: an Introduction to Clustering Algorithms
24,IOTA’s Data Marketplace: Setting the record straight
25,IOTA Data Marketplace
26,"If you want to learn Data Science, take a few of these statistics classes"
27,Improving your Algorithms & Data Structure Skills
28,"Super Mario World made only with CSS gradients - no JS, no embedded images/data URIs, no external images and using a micro HTML =)"
29,Aspiring data scientist? Master these fundamentals.
30,Ten Machine Learning Algorithms You Should Know to Become a Data Scientist
31,Your Data is Being Manipulated
32,"What makes an article popular on Medium? We analyzed 10,000+ data points to find out"
33,The 14 Most Destructive Millennial Myths Debunked by Data
34,10 Common Data Structures Explained with Videos + Exercises
35,Top 15 Python Libraries for Data Science in 2017
36,Beautiful Data Science Presentations
37,Fueling the Gold Rush: The Greatest Public Datasets for AI
38,Mastering Python Web Scraping: Get Your Data Back
39,1.4 Billion Clear Text Credentials Discovered in a Single Database
40,This New Data Will Make You Rethink How You Write Headlines
41,5 Quick and Easy Data Visualizations in Python with Code
42,15 Stunning Data Visualizations (And What You Can Learn From Them)
43,The four data science skills I didn’t learn in grad school (and how to learn them!)
44,The Ten Fallacies of Data Science
45,The best free online courses of 2017 according to the data
46,"An Uber ride killed my brother, I am fixing it with Data Science"
47,How the Circle Line rogue train was caught with data
48,How Docker Can Help You Become A More Effective Data Scientist
49,The 25 most popular icebreaker questions based on four years of data
50,"To Close the Gender Gap, We Have to Close the Data Gap"
51,Handle JavaScript data structures with map/reduce
52,Quick Tip: The easiest way to grab data out of a web page in Python
53,Get Sheet Done — using Google Spreadsheets as your data backend
54,How to become a Data Scientist
55,A Gentle Introduction to Data Structures: How Stacks Work
56,How to set up a database if you’re a front-end developer
57,Data security expert Matthew Brussel joins Plaza Systems
58,A Gentle Introduction to Data Structures: How Graphs Work
59,The Architecture of a Data Visualization
60,Data Science Interview Guide
61,The 3 Data Streams That Every Founder Needs
62,How to get your first job in Data Science?
63,"Architecture of Giants: Data Stacks at Facebook, Netflix, Airbnb, and Pinterest"
64,Data scientists mostly just do arithmetic and that’s a good thing
65,Top Algorithms and Data Structures You Really Need To Know
66,Want To Become a Data Scientist? Try Feynman Technique.
67,"How Your Data is Stored, or, The Laws of the Imaginary Greeks"
68,Lifecycle Aware Data Loading with Android Architecture Components
69,Quick Intro to Statistics — Power Your Stories with Data
70,Semantics — What does data science reveal about Clinton and Trump ?
71,How Quantitative UX Research Differs from Data Analytics
72,A Beginner’s Guide to Data Engineering — Part II
73,What Getting A Job In Data Science Might Look Like
74,We’re building a massive public dataset about new coders
75,What you do after you graduate matters way more than where you went to school. Here’s the data.
76,Making loading data on Android lifecycle aware
77,Aspiring Data Scientists! Start to learn Statistics with these 6 books!
78,Automated Machine Learning — A Paradigm Shift That Accelerates Data Scientist Productivity @ Airbnb
79,Docker for Data Science
80,Crafting Data-Driven Maps
81,"Web Scraping, Regular Expressions, and Data Visualization: Doing it all in Python"
82,Improving performance with background data prefetching
83,Ace Your Javascript Interview — Learn Algorithms + Data Structures.
84,The 50 best free online university courses according to the data
85,The 7 Kinds of Data Visualization People
86,NanoNets : How to use Deep Learning when you have Limited Data
87,Bitcoin Data Science (Pt. 1): HODL Waves
88,Open Machine Learning Course. Topic 1. Exploratory Data Analysis with Pandas
89,Data Scientist Resume Projects
90,Why Big Data Needs Thick Data
91,How to write a production-level code in Data Science?
92,Chart — the most powerful data visualization plugin for Sketch
93,Adobe XD: Designing with Real Data
94,“We’ve centralized all of our data to a guy called Mark Zuckerberg” says Pirate Bay Founder.
95,Boost your data science skills. Learn linear algebra.
96,Practical Data Structures Guide for Android developers
97,Passing Data Between React Components
98,Democratizing Data at Airbnb
99,Collecting Data Science Cheat Sheets
100,Los Angeles Just Proposed the Worst Use of License Plate Reader Data in History.
101,Data Science Simplified Part 1: Principles and Process
102,My Journey Into Data Science
103,"Data, Power, And War"
104,"Where to Hold React Component Data: state, store, static, and this"
105,45 Ways to Activate Your Data Science Career
106,Jupyter Notebook Tricks for Data Science that Enhance your efficiency
107,How Airbnb Democratizes Data Science With Data University
108,"Data Humanism, the Revolution will be Visualized."
109,How to Create Viral Content with Studies in Neuroscience and Past Data
110,Data Infrastructure at Airbnb
111,"A practical guide to fetch(), reduce() and formatting data from an external API"
112,Android Data Binding: RecyclerView
113,5 Data Storytelling Tips for Creating More Persuasive Charts and Graphs
114,Aspiring Data Scientists! Learn the basics with these 7 books!
115,I have data. I need insights. Where do I start?
116,Learning languages very quickly — with the help of some very basic Data Science
117,Data Science and the Art of Producing Entertainment at Netflix
118,NoSQL Databases: a Survey and Decision Guidance
119,Understanding Feature Engineering (Part 1) — Continuous Numeric Data
120,Bruises — The Data We Don’t See
121,Diary of a Data Scientist at Booking.com
122,A brief tour of Python 3.7 data classes
123,Minimalistic Learning Path to Become a Data Scientist
124,Introducing Semiotic for Data Visualization
125,"Updated Feed with Data Points, Fraud Protection, Data Quality Improvement"
126,Python Basics for Data Science
127,Python Data Types
128,Fetching API Data with React.JS
129,"Lessons from building mobile-friendly, accessible data tables"
130,How We Use Data to Inspire Design
131,Learn to visualize data with this free D3.js course
132,Using data to figure out TRAFFIC
133,Interactive Data Science with Jupyter Notebooks
134,A quick but complete guide to IndexedDB and storing data in browsers
135,Superset: Airbnb’s data exploration platform
136,"Immutable.js, persistent data structures and structural sharing"
137,Hiring Data Scientists Step 1: Stop Looking for Data Scientists.
138,Data Visualisation with 1 Billion Shazam Music Recognitions
139,Functional Data Engineering — a modern paradigm for batch data processing
140,"“POTUS isn’t just suppressing, he’s destroying data — they’re taking computers.”"
141,Who contributed the most to open source in 2017? Let’s analyze GitHub’s data and find out.
142,iOS: Three ways to pass data from Model to Controller
143,The Lie that Data is Scarce Costs the Working Poor a Fourth of Their Working Lives
144,Data Science and Machine Learning Interview Questions
145,How To Create Data Products That Are Magical Using Sequence-to-Sequence Models
146,Why you should forget ‘for-loop’ for data science code and embrace vectorization
147,The Art of Effective Visualization of Multi-dimensional Data
148,From AI to Blockchain to Data: Meet Ocean
149,"Signals’ new partnership with Foxconn’s data center, SafeDX"
150,"Working hand in hand, Signals and SafeDX…"
151,"You Say Data, I Say System"
152,Scaling Time Series Data Storage — Part I
153,Review: Udacity Data Analyst Nanodegree Program
154,Get better data from user studies: 16 interviewing tips
155,You Won’t Believe All the Personal Data Facebook Has Collected on You
156,Efficient data structures for PHP 7
157,Google Colaboratory — Simplifying Data Science Workflow
158,An overview of every Data Visualization course on the internet
159,10 things every aspiring data scientist needs to know
160,10 Data Acquisition Strategies for Startups
161,Data Visualization — People remember the feeling not the numbers
162,Rise of the Data Product Manager
163,A Gentle Introduction to Data Structures: How Linked Lists Work
164,The best data science learning resources out there and my journey into data science-
165,"With open data, you finally get what you’ve paid for all these years"
166,LinkedIn endorsements are dumb. Here’s the data.
167,The data behind our community’s first year on Medium
168,"No, the Divide in American Politics Is Not Rural vs. Urban, and Here’s the Data to Prove It"
169,Data science with Python: Turn your conditional loops to Numpy vectors
170,How To Ace Data Science Interviews: Statistics
171,20 Weird & Wonderful Datasets for Machine Learning
172,A Beginner’s Guide to the Data Science Pipeline
173,What is a Senior Data Visualization Engineer?
174,WTF is Vuex? A Beginner’s Guide To Vue’s Application Data Store
175,Data Science for Startups: Introduction
176,Service mesh data plane vs. control plane
177,There be dragons: dataviz in the industry
178,Even This Data Guru Is Creeped Out By What Anonymous Location Data Reveals About Us
179,Data Visualization “Versus” UI and Data Science
180,Data Analytics with Python by Web scraping: Illustration with CIA World Factbook
181,Advisory: AccuWeather iOS app sends location information to data monetization firm
182,All the data we lost to incompatible APIs.
183,Superset: Scaling Data Access and Visual Insights at Airbnb
184,4 Years of Data Science at Schibsted Media Group
185,7 Data Visualization Types You Should be Using More (and How to Start)
186,Using R packages and education to scale Data Science at Airbnb
187,A better way to update UICollectionView data in Swift with diff framework
188,Familiar friends
189,Resumes suck. Here’s the data.
190,The two sides of Getting a Job as a Data Scientist
191,Teach Yourself Data Science: the learning path I used to get an analytics job at Jet.com
